{
  "$schema": "http://json-schema.org/draft-04/schema#",
  "title": "Patron Hold Schema",
  "type": "object",
  "description": "Hold schema for patron portal integration",
  "additionalProperties": true,
  "properties": {
    "requestId": {
      "type": "string",
      "description": "The UUID of the request"
    },
    "itemId": {
      "description": "ID of the item being requested",
      "type": "string",
      "$ref": "raml-util/schemas/uuid.schema"
    },
    "item": {
      "type": "object",
      "description": "The item  being requested",
      "$ref": "item.json"
    },
    "requestLevel": {
      "description": "Level of the request - Item or Title",
      "type": "string",
      "enum": ["Item", "Title"]
    },
    "instanceId": {
      "description": "ID of the instance being requested",
      "type": "string",
      "$ref": "raml-util/schemas/uuid.schema"
    },
    "instance": {
      "type": "object",
      "description": "The item that is checked out",
      "$ref": "instance.json"
    },
    "requester": {
      "description": "Copy of some requesting patron metadata (used for searching and sorting), will be taken from the user referred to by the requesterId",
      "type": "object",
      "properties": {
        "barcode": {
          "description": "barcode of the patron (read only, defined by the server)",
          "type": "string",
          "readonly": true
        }
      },
      "additionalProperties": false
    },
    "requestDate": {
      "type": "string",
      "format": "date-time",
      "description": "The date when the request was made"
    },
    "expirationDate": {
      "type": "string",
      "format": "date-time",
      "description": "The date when the request expires"
    },
    "status": {
      "type": "string",
      "description": "The status of the hold request",
      "enum": [
        "Open - Not yet filled",
        "Open - Awaiting pickup",
        "Open - In transit",
        "Closed - Filled",
        "Closed - Cancelled"
      ]
    },
    "pickupLocationId": {
      "type": "string",
      "pattern": "^[0-9a-fA-F]{8}-[0-9a-fA-F]{4}-[1-5][0-9a-fA-F]{3}-[89abAB][0-9a-fA-F]{3}-[0-9a-fA-F]{12}$",
      "description": "The UUID of the pick up location"
    },
    "queuePosition": {
      "type": "integer",
      "description": "The position in the queue for this patron"
    },
    "cancellationReasonId": {
      "type": "string",
      "pattern": "^[0-9a-fA-F]{8}-[0-9a-fA-F]{4}-[1-5][0-9a-fA-F]{3}-[89abAB][0-9a-fA-F]{3}-[0-9a-fA-F]{12}$",
      "description": "The id of the request reason"
    },
    "canceledByUserId": {
      "type": "string",
      "pattern": "^[0-9a-fA-F]{8}-[0-9a-fA-F]{4}-[1-5][0-9a-fA-F]{3}-[89abAB][0-9a-fA-F]{3}-[0-9a-fA-F]{12}$",
      "description": "The id of the user that cancelled the request"
    },
    "cancellationAdditionalInformation": {
      "description": "Additional information about a cancellation",
      "type": "string"
    },
    "canceledDate": {
      "description": "Date the request was cancelled",
      "type": "string",
      "format": "date-time"
    },
    "patronComments": {
      "description": "Comments made by the patron",
      "type": "string"
    }
  },
  "required": [
    "requestDate",
    "pickupLocationId"
  ]
}
