{
    "requestId": "dd238b5b-01fc-4205-83b8-888888888888",
    "item": {
        "instanceId": "23611f0b-35cc-4f40-af09-75907d7cc421",
        "itemId": "32e5757d-6566-466e-b69d-994eb33d2b73",
        "title": "Something's Got a Hold on Me",
        "author": "Etta James; Leroy Kirkland; Pearl Woods"
    },
    "requestDate": "2018-05-30T08:01:30Z",
    "expirationDate": "3000-01-30T08:16:30Z",
    "status": "Closed - Cancelled",
    "cancellationReasonId": "b548b182-55c2-4741-b169-616d9cd995a8",
    "canceledByUserId": "ab5a5c57-491c-4b08-8f39-907810e14913",
    "cancellationAdditionalInformation": "I don't want it anymore",
    "canceledDate": "2019-11-06T16:23:30.262+0000",
    "pickupLocationId": "963396d7-c96f-4bb1-a24c-42e868a8823d"
}
